number,value,datetime_start,datetime_complete,duration,params_act_fn,params_d_h1,params_d_h2,params_d_h3,params_dropout,params_lr,params_n_layers,params_optimizer_name,params_use_bn,params_weight_decay,state
0,0.6600336280104291,2025-11-15 19:31:25.087012,2025-11-15 19:31:28.831819,0 days 00:00:03.744807,ReLU,128,128,32.0,0.0,0.000895248295548313,3,AdamW,False,0.004104801322797255,COMPLETE
1,0.6516255549251231,2025-11-15 19:31:28.832162,2025-11-15 19:31:52.204683,0 days 00:00:23.372521,ReLU,64,128,,0.30000000000000004,0.00015267235710272585,2,SGD,True,0.008619362554097901,COMPLETE
2,0.6642376662904371,2025-11-15 19:31:52.205021,2025-11-15 19:31:59.000032,0 days 00:00:06.795011,ReLU,64,32,,0.2,0.0005520587083546094,2,AdamW,False,1.4412495819660664e-05,COMPLETE
3,0.6586322861936594,2025-11-15 19:31:59.000469,2025-11-15 19:32:09.973087,0 days 00:00:10.972618,SiLU,64,64,64.0,0.4,0.009251319876195473,3,SGD,False,0.009025551263767147,COMPLETE
4,0.6661995494312235,2025-11-15 19:32:09.973475,2025-11-15 19:32:30.893974,0 days 00:00:20.920499,SiLU,128,128,32.0,0.30000000000000004,0.0017488208334496002,3,SGD,True,0.005863536888534808,COMPLETE
5,0.6457399116503284,2025-11-15 19:32:30.894452,2025-11-15 19:32:54.462679,0 days 00:00:23.568227,GELU,64,32,32.0,0.2,0.00018657091840197282,3,SGD,False,9.330012326753598e-05,COMPLETE
6,0.6563901339945771,2025-11-15 19:32:54.463120,2025-11-15 19:33:12.737465,0 days 00:00:18.274345,SiLU,256,32,16.0,0.4,0.0020876261134260173,3,SGD,True,3.902394855302039e-05,COMPLETE
7,0.6653587427909065,2025-11-15 19:33:12.737915,2025-11-15 19:33:17.470602,0 days 00:00:04.732687,SiLU,128,32,,0.4,0.0010891378071790575,2,AdamW,True,0.005382309107072685,COMPLETE
8,0.6647982041397437,2025-11-15 19:33:17.470976,2025-11-15 19:33:40.736587,0 days 00:00:23.265611,GELU,256,32,,0.4,0.0014308523326198605,2,SGD,True,0.006734880203859069,COMPLETE
9,0.6468609860125144,2025-11-15 19:33:40.737019,2025-11-15 19:34:09.382366,0 days 00:00:28.645347,GELU,128,32,64.0,0.30000000000000004,0.00024677964857275396,3,SGD,True,0.0006392925186966505,COMPLETE
10,0.652466364772865,2025-11-15 19:34:09.382736,2025-11-15 19:34:12.987317,0 days 00:00:03.604581,SiLU,128,128,32.0,0.0,0.004565082505824285,3,AdamW,True,0.0011098506887138682,COMPLETE
11,0.6659192782346444,2025-11-15 19:34:12.987857,2025-11-15 19:34:17.765536,0 days 00:00:04.777679,SiLU,128,64,,0.5,0.0027957528115376074,2,AdamW,True,0.0018592512553546221,COMPLETE
12,0.6667600854095322,2025-11-15 19:34:17.766038,2025-11-15 19:34:22.689167,0 days 00:00:04.923129,SiLU,128,64,,0.5,0.0032138453660665554,2,AdamW,True,0.0015372769280300425,COMPLETE
13,0.6678811605735745,2025-11-15 19:34:22.689635,2025-11-15 19:34:29.413014,0 days 00:00:06.723379,SiLU,128,64,,0.5,0.004868529549814101,2,AdamW,True,0.00018637440037716128,COMPLETE
14,0.6614349738364796,2025-11-15 19:34:29.413506,2025-11-15 19:34:35.727926,0 days 00:00:06.314420,SiLU,128,64,,0.5,0.005842961924738116,2,AdamW,True,0.00021007660148266783,COMPLETE
15,0.6673206235261241,2025-11-15 19:34:35.728370,2025-11-15 19:34:40.359864,0 days 00:00:04.631494,SiLU,128,64,,0.5,0.0037093440084722826,2,AdamW,True,0.0002851845081111821,COMPLETE
16,0.6608744349180316,2025-11-15 19:34:40.360242,2025-11-15 19:34:43.889975,0 days 00:00:03.529733,SiLU,256,64,,0.1,0.009312543081387766,2,AdamW,True,0.0002452780240617028,COMPLETE
17,0.6681614288300142,2025-11-15 19:34:43.890321,2025-11-15 19:34:50.420060,0 days 00:00:06.529739,SiLU,128,64,,0.5,0.00508769192539987,2,AdamW,True,8.109151154012075e-05,COMPLETE
18,0.6594730936358327,2025-11-15 19:34:50.420487,2025-11-15 19:34:53.881972,0 days 00:00:03.461485,ReLU,128,64,,0.5,0.005566474732494196,2,AdamW,False,7.771871449209783e-05,COMPLETE
19,0.6633968564426952,2025-11-15 19:34:53.882425,2025-11-15 19:35:06.128005,0 days 00:00:12.245580,GELU,256,64,,0.4,0.000482810241799615,2,AdamW,True,1.8424144860275348e-05,COMPLETE
20,0.6656390107800608,2025-11-15 19:35:06.128503,2025-11-15 19:35:09.489148,0 days 00:00:03.360645,SiLU,128,64,,0.1,0.007220475349348943,2,AdamW,True,9.913636961086288e-05,COMPLETE
21,0.6681614309682974,2025-11-15 19:35:09.489551,2025-11-15 19:35:14.341923,0 days 00:00:04.852372,SiLU,128,64,,0.5,0.003604549419863061,2,AdamW,True,0.0005276137748982887,COMPLETE
22,0.6656390091763483,2025-11-15 19:35:14.342359,2025-11-15 19:35:19.233763,0 days 00:00:04.891404,SiLU,128,64,,0.5,0.00278919036230042,2,AdamW,True,0.0006037768455274918,COMPLETE
23,0.6605941671961626,2025-11-15 19:35:19.234111,2025-11-15 19:35:24.565281,0 days 00:00:05.331170,SiLU,128,64,,0.4,0.004458715603475501,2,AdamW,True,4.788848341684442e-05,COMPLETE
24,0.6676008925844201,2025-11-15 19:35:24.565646,2025-11-15 19:35:31.513639,0 days 00:00:06.947993,SiLU,128,64,,0.5,0.0022409518100656397,2,AdamW,True,0.00015866787521971558,COMPLETE
25,0.6650784710597565,2025-11-15 19:35:31.514186,2025-11-15 19:35:38.285041,0 days 00:00:06.770855,SiLU,128,64,,0.5,0.007036917483109683,2,AdamW,True,0.00044023820785007084,COMPLETE
26,0.6631165895226825,2025-11-15 19:35:38.285497,2025-11-15 19:35:41.830252,0 days 00:00:03.544755,SiLU,128,64,,0.4,0.003980013997386619,2,AdamW,False,4.35869229585441e-05,COMPLETE
27,0.6690022400141832,2025-11-15 19:35:41.830701,2025-11-15 19:36:00.531160,0 days 00:00:18.700459,SiLU,128,64,,0.30000000000000004,0.00010419165699769275,2,AdamW,True,0.00013970207154288307,COMPLETE
28,0.6676008925844201,2025-11-15 19:36:00.531562,2025-11-15 19:36:16.840641,0 days 00:00:16.309079,ReLU,256,64,,0.30000000000000004,0.0001177528125612635,2,AdamW,True,0.0001220291953709918,COMPLETE
29,0.6636771281738453,2025-11-15 19:36:16.841023,2025-11-15 19:36:21.198685,0 days 00:00:04.357662,GELU,64,128,,0.2,0.0005347797752942416,2,AdamW,False,0.0031076839836306717,COMPLETE
30,0.6687219709558871,2025-11-15 19:36:21.199074,2025-11-15 19:36:27.878143,0 days 00:00:06.679069,ReLU,128,64,,0.1,0.0003475652038017826,2,AdamW,True,2.268308470331112e-05,COMPLETE
31,0.6642376676268642,2025-11-15 19:36:27.878523,2025-11-15 19:36:31.693030,0 days 00:00:03.814507,ReLU,128,64,,0.0,0.0003095242341410017,2,AdamW,True,2.2945642871436706e-05,COMPLETE
32,0.6631165916609657,2025-11-15 19:36:31.693449,2025-11-15 19:36:39.436412,0 days 00:00:07.742963,ReLU,128,64,,0.1,0.00010175747692928957,2,AdamW,True,2.6799195397426462e-05,COMPLETE
33,0.6642376646867247,2025-11-15 19:36:39.436818,2025-11-15 19:36:45.066724,0 days 00:00:05.629906,ReLU,128,128,,0.2,0.0006922292103900668,2,AdamW,True,1.0560741148790056e-05,COMPLETE
34,0.6563901313217232,2025-11-15 19:36:45.067135,2025-11-15 19:36:49.907951,0 days 00:00:04.840816,ReLU,64,64,,0.1,0.00031306679829545613,2,AdamW,True,6.224719316818218e-05,COMPLETE
35,0.6647982030706021,2025-11-15 19:36:49.908480,2025-11-15 19:37:08.397209,0 days 00:00:18.488729,ReLU,128,64,,0.30000000000000004,0.0001551684986436355,2,AdamW,False,0.0003546509025533325,COMPLETE
36,0.6597533640305557,2025-11-15 19:37:08.397579,2025-11-15 19:37:23.151230,0 days 00:00:14.753651,ReLU,64,128,,0.0,0.0010317533766092898,2,SGD,True,2.959983076347884e-05,COMPLETE
37,0.6617152436966319,2025-11-15 19:37:23.151596,2025-11-15 19:37:34.162384,0 days 00:00:11.010788,SiLU,128,64,16.0,0.2,0.0004078727117459857,3,AdamW,True,0.00012394812551234002,COMPLETE
38,0.6580717494134946,2025-11-15 19:37:34.162827,2025-11-15 19:37:53.564779,0 days 00:00:19.401952,SiLU,128,64,,0.30000000000000004,0.0008114019592572714,2,SGD,False,1.3575546865845539e-05,COMPLETE
39,0.6619955114185008,2025-11-15 19:37:53.565157,2025-11-15 19:38:14.205101,0 days 00:00:20.639944,ReLU,64,32,,0.2,0.00023784476494817647,2,AdamW,True,6.268467551246028e-05,COMPLETE
40,0.6569506726457399,2025-11-15 19:38:14.205546,2025-11-15 19:38:41.686135,0 days 00:00:27.480589,GELU,128,64,16.0,0.4,0.0013975118068475137,3,SGD,True,0.0007856844436675663,COMPLETE
41,0.6645179326758791,2025-11-15 19:38:41.686523,2025-11-15 19:38:48.651251,0 days 00:00:06.964728,SiLU,128,64,,0.5,0.007087788757717432,2,AdamW,True,0.00018880624073594346,COMPLETE
42,0.6614349751729067,2025-11-15 19:38:48.651643,2025-11-15 19:38:55.439688,0 days 00:00:06.788045,SiLU,128,64,,0.4,0.002146757078599973,2,AdamW,True,0.00013499667492076033,COMPLETE
43,0.6631165879189701,2025-11-15 19:38:55.440055,2025-11-15 19:39:02.348282,0 days 00:00:06.908227,SiLU,128,64,,0.5,0.005401020592645256,2,AdamW,True,0.00040357857775031556,COMPLETE
44,0.6628363193952449,2025-11-15 19:39:02.348647,2025-11-15 19:39:07.369364,0 days 00:00:05.020717,SiLU,128,32,,0.30000000000000004,0.0015263028732061903,2,AdamW,True,8.280003515136567e-05,COMPLETE
45,0.6645179334777354,2025-11-15 19:39:07.369902,2025-11-15 19:39:26.192412,0 days 00:00:18.822510,SiLU,256,64,,0.4,0.00022240909614264188,2,AdamW,True,0.0004934043072724381,COMPLETE
46,0.6647982041397437,2025-11-15 19:39:26.192862,2025-11-15 19:39:45.570804,0 days 00:00:19.377942,SiLU,128,128,,0.5,0.000157700088615849,2,AdamW,True,0.0009692454418343587,COMPLETE
47,0.6673206261989781,2025-11-15 19:39:45.571284,2025-11-15 19:39:58.214911,0 days 00:00:12.643627,SiLU,128,64,,0.1,0.003247667959728961,2,SGD,True,0.0002544929208375419,COMPLETE
48,0.6647982046743145,2025-11-15 19:39:58.215320,2025-11-15 19:40:08.621329,0 days 00:00:10.406009,SiLU,128,32,64.0,0.4,0.00036368943928180087,3,AdamW,True,0.00031761863174280453,COMPLETE
49,0.6552690566922517,2025-11-15 19:40:08.621799,2025-11-15 19:40:11.853480,0 days 00:00:03.231681,GELU,128,64,,0.5,0.009837558299543962,2,AdamW,False,3.465528646688601e-05,COMPLETE
